index,reason,company,product_descrpition,brand_name,date,url
984,http://www.fda.gov/Safety/Recalls/ucm241359.htm,"Circle City Marketing and Distributing, DBA Candy Dynamics",Chew Bars,Toxic Waste,Lead,01/2011
985,http://www.fda.gov/Safety/Recalls/ucm241280.htm,Peekay International Inc.,Raisins,Swan,Undeclared sulfites,01/2011
986,http://www.fda.gov/Safety/Recalls/ucm241070.htm,"Pfizer Inc. and Progenics  Pharmaceuticals, Inc.",Relistor kit containing alcohol prep pads,Relistor,Contains potentially contaminated alcohol prep pads,01/2011
987,http://www.fda.gov/Safety/Recalls/ucm241088.htm,State Garden,Salad mixes,"Gold Quality, Hannaford, Natures Place, more",Listeria monocytogenes,01/2011
988,http://www.fda.gov/Safety/Recalls/ucm240988.htm,Ian&#39;s,Mac and No Cheese; French Bread Pizza,Ian&#39;s,Listeria monocytogenes,01/2011
989,http://www.fda.gov/Safety/Recalls/ucm241097.htm,GlaxoSmithKline,ARIXTRA Starter Kit containing alcohol prep pads,GlaxoSmithKline,Contains potentially contaminated alcohol prep pads,01/2011
990,http://www.fda.gov/Safety/Recalls/ucm242199.htm,"Shaping Beauty, Inc.",Celerite Slimming Capsules,Celerite,"Sibutramine, an undeclared drug ingredient",01/2011
991,http://www.fda.gov/Safety/Recalls/ucm240710.htm,"Pretzels, Inc.",Corn Pops,Better Made,Undeclared milk,01/2011
992,http://www.fda.gov/Safety/Recalls/ucm240564.htm,"Hawaii Business Group, Incorporated; Barb’s Favorite Recipes; and Ohana Seafoods",Black Bean Sauce,Barb’s Local Style and Ohana Flavors,Clostridium botulinum,01/2011
993,http://www.fda.gov/Safety/Recalls/ucm240560.htm,Mama Rose&#39;s Gourmet Foods,"Cilantro Con Queso, Garlic Con Queso, Viper Venom Con Queso, and Hopi Corn Salsa","Mama Rose&#39;s, Fred Harvey",Clostridium botulinum,01/2011
994,http://www.fda.gov/Safety/Recalls/ucm240558.htm,Bayer HealthCare Pharmaceuticals,Betaseron kit containing alcohol prep pads,Betaseron,Contains potentially contaminated alcohol prep pads,01/2011
995,http://www.fda.gov/Safety/Recalls/ucm240827.htm,King &amp; Prince Seafood,Breaded Calamari Rings,Mrs. Friday’s,Undeclared peanuts,01/2011
996,http://www.fda.gov/Safety/Recalls/ucm240448.htm,Barrel O’ Fun Snack Foods Co.,Potato Chips,Valu Time,Undeclared milk protein,01/2011
997,http://www.fda.gov/Safety/Recalls/ucm240467.htm,Rich Products Corporation,Deep Deveined Shrimp,Sonny’s Barbeque,Undeclared Milk Ingredient,01/2011
998,http://www.fda.gov/Safety/Recalls/ucm240840.htm,Kanec USA,Nite Rider Maximum Sexual Enhancer For Men and STUD  Capsules for Men Male Enhancement Herbal Supplement Capsules Marketed as Dietary Supplements,"Stud, Nite Rider","Adulterated with Sildenafil, an FDA approved drug used in the treatment of Erectile Dysfunction (ED), making the products unapproved new drugs",01/2011
999,http://www.fda.gov/Safety/Recalls/ucm240218.htm,McNeil Consumer Healthcare,"TYLENOL® 8 Hour, TYLENOL® Arthritis Pain, and TYLENOL® upper respiratory products, and certain lots of BENADRYL®, SUDAFED PE®, and SINUTAB®","TYLENOL, BENADRYL, SUDAFED PE",Production records found instances where equipment cleaning procedures were insufficient or that cleaning was not adequately documented.,01/2011
1000,http://www.fda.gov/Safety/Recalls/ucm240240.htm,Barry Callebaut USA LLC,Chocolate Chips,Kroger,Undeclared milk,01/2011
1001,http://www.fda.gov/Safety/Recalls/ucm240012.htm,"Circle City Marketing and Distributing, DBA Candy Dynamics",Chew Bars,Toxic Waste,Lead,01/2011
1002,http://www.fda.gov/Safety/Recalls/ucm240131.htm,"Genentech, Inc.",Medicine Kits,"Boniva, Fuseon, Pegasys, Others",Kits contain alcohol prep pads that were recently recalled by the Triad Group due to potential contamination with Bacillus cereus,01/2011
1003,http://www.fda.gov/Safety/Recalls/ucm240168.htm,MS Fish Corp.,Schmaltz Herring,Ossie’s,Listeria Monocytogenes,01/2011
1004,http://www.fda.gov/Safety/Recalls/ucm239913.htm,Barry Callebaut USA LLC,Chocolate Chips,Kroger,Undeclared milk,01/2011
1005,http://www.fda.gov/Safety/Recalls/ucm239718.htm,Surtex Foods,Oaxaca string Cheese La Original,La Original,Contaminated with Listeria monocytogenes and Staphylococcus aureus,01/2011
1006,http://www.fda.gov/Safety/Recalls/ucm241610.htm,Novartis Pharmaceuticals Corporation,Extavia kit containing alcohol prep pads,Extavia,Contain alcohol prep pads that were recently recalled by the Triad Group due to potential contamination with Bacillus cereus,01/2011
1007,http://www.fda.gov/Safety/Recalls/ucm239519.htm,"La Placita Botanas Mexicanas, Inc.","Snack Products with Chile: Wheat Snacks, Potato Chips, and Corn Churritos",La Placita,Salmonella,01/2011
1008,http://www.fda.gov/Safety/Recalls/ucm239229.htm,"Teva Pharmaceuticals, U.S.A",Metronidazole Tablets,Teva Pharmaceuticals,Underweight Tablets,01/2011
1009,http://www.fda.gov/Safety/Recalls/ucm239335.htm,"Boncheff Greenhouses, Inc.","Cilantro, Curly Parsley, Italian Parsley","Boncheff, Wegmans",Salmonella,01/2011
1010,http://www.fda.gov/Safety/Recalls/ucm239219.htm,Triad Group,"Alcohol Prep Pads, Alcohol Swabs, and Alcohol Swabsticks","VersaPro, Cardinal Health, PSS Select, Others",Bacillus cereus,01/2011
1011,http://www.fda.gov/Safety/Recalls/ucm238636.htm,"Sprouters Northwest, Inc.",Sprouts,"Sprouters Northwest, Brocco",Salmonella,01/2011
1012,http://www.fda.gov/Safety/Recalls/ArchiveRecalls/2010/ucm238492.htm,Drive Total Energy,Rock Hard Extreme and Passion Coffee Dietary Supplements,"RockHard Extreme, Passion Coffee",Unapproved drugs - contain an analog of Sildenafil,12/2010
1013,http://www.fda.gov/Safety/Recalls/ArchiveRecalls/2010/ucm238493.htm,Cumberland Pharmaceuticals Inc,Acetadote® (acetylcysteine) Injection,Acetadote,May contain particulates,12/2010
1014,http://www.fda.gov/Safety/Recalls/ArchiveRecalls/2010/ucm238495.htm,PRock Marketing LLC,Fruta Planta Capsules,Fruta Planta,Unapproved new drug - contains sibutramine,12/2010
1015,http://www.fda.gov/Safety/Recalls/ArchiveRecalls/2010/ucm238528.htm,The Ritedose Corporation,Albuterol Inhalation Solution,,Incorrect concentration listed,12/2010
1016,http://www.fda.gov/Safety/Recalls/ArchiveRecalls/2010/ucm238417.htm,Tiny Greens,Sprouts,Tiny Greens,Salmonella,12/2010
1017,http://www.fda.gov/Safety/Recalls/ArchiveRecalls/2010/ucm239530.htm,AngioScore Incorporated,PTA Scoring Balloon Catheter,AngioSculpt,"distal bond failure which has resulted in peeling of the bond and/or detachment of the distal end of the scoring element, wherein the proximal end of the scoring element remains secured to the catheter",12/2010
1018,http://www.fda.gov/Safety/Recalls/ArchiveRecalls/2010/ucm238370.htm,J&amp;D Produce,Fresh produce,Little Bear,Salmonella,12/2010
1019,http://www.fda.gov/Safety/Recalls/ArchiveRecalls/2010/ucm238461.htm,Mexicantown Wholesale,Cuernos (croissants),Mexicantown,Undeclared milk,12/2010
1020,http://www.fda.gov/Safety/Recalls/ArchiveRecalls/2010/ucm238112.htm,Whole Foods Market,ginger bread houses,Whole Food Market (WFM),Staphylococcus aureus,12/2010
1021,http://www.fda.gov/Safety/Recalls/ArchiveRecalls/2010/ucm238111.htm,Whole Foods Market,Bakery Products and Prepared Foods,Whole Food Market (WFM),Staphylococcus aureus,12/2010
1022,http://www.fda.gov/Safety/Recalls/ArchiveRecalls/2010/ucm238089.htm,"Brand Castle, LLC",Rice Krispies Treats Holiday Village Kit,Kellogg&#39;s,Undeclared egg,12/2010
1023,http://www.fda.gov/Safety/Recalls/ArchiveRecalls/2010/ucm238227.htm,American Regent,"Sodium Bicarbonate Injection, USP, 7.5% 
and 8.4%, 50 mL Single Dose Vials",American Regent,May contain particulates,12/2010
1024,http://www.fda.gov/Safety/Recalls/ArchiveRecalls/2010/ucm238105.htm,South Florida Bakery,Coconut Macaroons (Coquitos),Publix Bakery,Undeclared milk,12/2010
1025,http://www.fda.gov/Safety/Recalls/ArchiveRecalls/2010/ucm238306.htm,ev3,Dilation catheter,NanoCross,May crack or break during use,12/2010
1026,http://www.fda.gov/Safety/Recalls/ArchiveRecalls/2010/ucm237683.htm,JFC International Inc.,Frozen capelin fish,,The fish is uneviscerated and poses a potential hazard for botulism.,12/2010
1027,http://www.fda.gov/Safety/Recalls/ArchiveRecalls/2010/ucm237999.htm,RockHard Laboratories,RockHard Weekend and Pandora dietary supplements,"RockHard Weekend, Pandora",Unapproved drug - contain an analog of Sildenafil,12/2010
1028,http://www.fda.gov/Safety/Recalls/ArchiveRecalls/2010/ucm238095.htm,Abbott Diabetes Care,Glucose test strips,,may give falsely low blood glucose results,12/2010
1029,http://www.fda.gov/Safety/Recalls/ArchiveRecalls/2010/ucm237938.htm,Pfizer,Lipitor,Lipitor,off odor,12/2010
1030,http://www.fda.gov/Safety/Recalls/ArchiveRecalls/2010/ucm238001.htm,American Reagent,"Dexamethasone Sodium Phosphate Injection, USP, 4 mg/mL",,May contain particulates,12/2010
1031,http://www.fda.gov/Safety/Recalls/ArchiveRecalls/2010/ucm237750.htm,Whole Foods Market,Cheese,"Whole Foods Market, Sally Jackson",E. coli O157:H7,12/2010
1032,http://www.fda.gov/Safety/Recalls/ArchiveRecalls/2010/ucm237791.htm,Bright Water Seafood,Seafood dip and spread,Bright Water,Listeria monocytogenes,12/2010
1033,http://www.fda.gov/Safety/Recalls/ArchiveRecalls/2010/ucm237459.htm,Kroger,Select packages of dog &amp; cat food,Brand 1 - Pet Pride; Brand 2 - Old Yeller; Brand 3 - Kroger Value,Products may contain aflatoxin.,12/2010
1034,http://www.fda.gov/Safety/Recalls/ArchiveRecalls/2010/ucm237304.htm,Sally Jackson Cheese,Cheese,,E. coli O157:H7,12/2010
1035,http://www.fda.gov/Safety/Recalls/ArchiveRecalls/2010/ucm237476.htm,"YNot Foods, Inc.",Orzo Toscano,Upsides,Undeclared milk and soy,12/2010
1036,http://www.fda.gov/Safety/Recalls/ArchiveRecalls/2010/ucm237494.htm,"Tofutti Brands, Inc.",Frozen Dessert Cones,Yours Truly,Undeclared milk,12/2010
1037,http://www.fda.gov/Safety/Recalls/ArchiveRecalls/2010/ucm236937.htm,Brinkman Turkey Farms Inc.,Barbecue Sauce,Brinkman&#39;s,Undeclared milk and soy,12/2010
1038,http://www.fda.gov/Safety/Recalls/ArchiveRecalls/2010/ucm236632.htm,"Toffuti Brands, Inc.",Frozen Dessert Cones,Yours Truly,Undeclared Milk,12/2010
1039,http://www.fda.gov/Safety/Recalls/ArchiveRecalls/2010/ucm236656.htm,Tropical Nut &amp; Fruit,Walnuts,"Atlas, Tropical, Harris Teeter",Salmonella,12/2010
1040,http://www.fda.gov/Safety/Recalls/ArchiveRecalls/2010/ucm236715.htm,"McNeil Consumer Healthcare, Division of McNEIL-PPC, Inc.",Rolaids Soft Chews,Rolaids,"Foreign materials, including metal and wood particles",12/2010
1041,http://www.fda.gov/Safety/Recalls/ArchiveRecalls/2010/ucm236509.htm,Reese Pharmaceutical Company,Cold Decongestant Tablets,"Refenesen, Select, QC Medifin, Others","Mislabeled: Acetaminophen, phenylephrine, and chlorpheniramine maleate not included",12/2010
1042,http://www.fda.gov/Safety/Recalls/ArchiveRecalls/2010/ucm236227.htm,Mojave Foods Corporation,Shelled Walnuts,El Guapo,Salmonella,12/2010
1043,http://www.fda.gov/Safety/Recalls/ArchiveRecalls/2010/ucm236232.htm,"Pablo&#39;s Produce, Inc.",Spreads,Pablo&#39;s Produce of USA,Salmonella,12/2010
1044,http://www.fda.gov/Safety/Recalls/ArchiveRecalls/2010/ucm236087.htm,"S&amp;S Food, Inc.",Dried fish Vobla gutted,Qualitat Fisch Kompass,Clostridium botulinum,12/2010
1045,http://www.fda.gov/Safety/Recalls/ArchiveRecalls/2010/ucm235848.htm,Intelli Health Products,"Dietary Supplements, Duro Extend Capsules For Men",Duro Extend,Unapproved drug - contains  Sulfoaidenafil,12/2010
1046,http://www.fda.gov/Safety/Recalls/ArchiveRecalls/2010/ucm235300.htm,Frontier Natural Products Co-op,Nutmeg,"Frontier Bulk, Whole Foods 365",Salmonella,11/2010
1047,http://www.fda.gov/Safety/Recalls/ArchiveRecalls/2010/ucm235924.htm,Rushing Waters Fisheries,Spreads,Rushing Waters Fisheries,Listeria monocytogenes,11/2010
1048,http://www.fda.gov/Safety/Recalls/ArchiveRecalls/2010/ucm235376.htm,"Johnson &amp; Johnson-Merck Consumer Pharmaceuticals, Co.",Mylanta and Alternagel Liquid Products,"Mylanta, Alternagel",Undeclared alcohol from flavoring agents,11/2010
1049,http://www.fda.gov/Safety/Recalls/ArchiveRecalls/2010/ucm235183.htm,"McCormick &amp; Company, Incorporated",All-Purpose Batter,Golden Dipt,Undeclared egg,11/2010
1050,http://www.fda.gov/Safety/Recalls/ArchiveRecalls/2010/ucm234903.htm,Whole Foods Market,Cheese,Bravo Farms,"E. coli O157:H7, Listeria monocytogenes",11/2010
1051,http://www.fda.gov/Safety/Recalls/ArchiveRecalls/2010/ucm234902.htm,"WalkMed Infusion, LLC",Pole Mount Infusion Pumps,Triton,Pump Door Open Alarm May Malfunction,11/2010
1052,http://www.fda.gov/Safety/Recalls/ArchiveRecalls/2010/ucm235900.htm,"Lobby Shoppes, Inc.",Popcorn,Lobby Shoppes,Undeclared milk and soy,11/2010
1053,http://www.fda.gov/Safety/Recalls/ArchiveRecalls/2010/ucm234997.htm,McNeil Consumer Healthcare,Tylenol Cold Liquid Products,Tylenol,Labeling update,11/2010
1054,http://www.fda.gov/Safety/Recalls/ArchiveRecalls/2010/ucm234699.htm,Artisan Confections Company,Candy,Dagoba,Salmonella,11/2010
1055,http://www.fda.gov/Safety/Recalls/ArchiveRecalls/2010/ucm234691.htm,Bravo Farms,Cheese,Bravo Farms,"E. coli O157:H7, Listeria monocytogenes",11/2010
1056,http://www.fda.gov/Safety/Recalls/ArchiveRecalls/2010/ucm234901.htm,Advanced Bionics,Cochlear Implants,HiRes 90K,"May malfunction, causing severe pain, overly loud sounds and/or shocking sensations",11/2010
1057,http://www.fda.gov/Safety/Recalls/ArchiveRecalls/2010/ucm234496.htm,Krunchers! Inc.,Potato Chips,Jay&#39;s,Undeclared milk,11/2010
1058,http://www.fda.gov/Safety/Recalls/ArchiveRecalls/2010/ucm234212.htm,Del Bueno,Cheese,Del Bueno,Listeria monocytogenes,11/2010
1059,http://www.fda.gov/Safety/Recalls/ArchiveRecalls/2010/ucm234996.htm,McNeil Consumer Healthcare,,Rolaids,Uncharacteristic consistency or texture,11/2010
1060,http://www.fda.gov/Safety/Recalls/ArchiveRecalls/2010/ucm235002.htm,McNeil Consumer Healthcare,"Children&#39;s Benadryl, Children&#39;s Motrin","Benadryl, Motrin",Insufficiencies in the development of the manufacturing process,11/2010
1061,http://www.fda.gov/Safety/Recalls/ArchiveRecalls/2010/ucm234012.htm,Liz Lovely,Cookies,Liz Lovely,Undeclared milk,11/2010
1062,http://www.fda.gov/Safety/Recalls/ArchiveRecalls/2010/ucm233940.htm,S&amp;M (U.S.A.) Enterprise Corp.,,Grow Grove Notes,Undeclared sulfites,11/2010
1063,http://www.fda.gov/Safety/Recalls/ArchiveRecalls/2010/ucm233727.htm,DPI Specialty Foods,Gorgonzola Cheese,Mauri,E. coli O157:H7,11/2010
1064,http://www.fda.gov/Safety/Recalls/ArchiveRecalls/2010/ucm233734.htm,DPI Specialty Foods,Gorgonzola Cheese,Mauri,E. coli O157:H7,11/2010
1065,http://www.fda.gov/Safety/Recalls/ArchiveRecalls/2010/ucm233273.htm,"Cal-Maine Foods, Inc.",,Pippin,Salmonella,11/2010
1066,http://www.fda.gov/Safety/Recalls/ArchiveRecalls/2010/ucm233078.htm,Bravo Farms,Dutch Style Gouda,Bravo Farms,E. coli O157:H7,11/2010
1067,http://www.fda.gov/Safety/Recalls/ArchiveRecalls/2010/ucm233235.htm,Fresh &amp; Easy Neighborhood Market,Cookie Dough,fresh&amp;easy,Undeclared peanuts,11/2010
1068,http://www.fda.gov/Safety/Recalls/ArchiveRecalls/2010/ucm232983.htm,"WalkMed Infusion, LLC",Triton Pole Mount Infusion Pumps,Triton,Pump Door Open Alarm May Malfunction,11/2010
1069,http://www.fda.gov/Safety/Recalls/ArchiveRecalls/2010/ucm232989.htm,Orval Kent Food Company,"Cilantro containing products: Salads, Dips, Ceviche, Dressing","Bistro, CA Pizza Kitchen, Chef Solutions, Fish House Foods, etc.",Salmonella in Cilantro,11/2010
1070,http://www.fda.gov/Safety/Recalls/ArchiveRecalls/2010/ucm232977.htm,"Baugher Enterprise, Inc.",Apple Cider,Baugher&#39;s,E. coli O157:H7,11/2010
1071,http://www.fda.gov/Safety/Recalls/ArchiveRecalls/2010/ucm232988.htm,"Cal-Maine Foods, Inc.",Shell Eggs,"Sunny Meadow, Springfield Grocer, Sun Valley, more",Salmonella,11/2010
1072,http://www.fda.gov/Safety/Recalls/ArchiveRecalls/2010/ucm232537.htm,Actavis U. S.,25 mcg/h Fentanyl patches,Actavis,Accelerated Release of Fentanyl,11/2010
1073,http://www.fda.gov/Safety/Recalls/ArchiveRecalls/2010/ucm232878.htm,Baugher&#39;s,Apple Cider,Baugher&#39;s,E. coli O157:H7,11/2010
1074,http://www.fda.gov/Safety/Recalls/ArchiveRecalls/2010/ucm232527.htm,"Beaver Street Fisheries, Inc.",Tuna Loins,Beaver Street,Elevated Levels of Histamine,11/2010
1075,http://www.fda.gov/Safety/Recalls/ArchiveRecalls/2010/ucm231855.htm,Medtronic Inc.,Tissue Stabilizer,Octopus,Can fracture during use,10/2010
1076,http://www.fda.gov/Safety/Recalls/ArchiveRecalls/2010/ucm231736.htm,Kosher First LLC,Nova Lox Salad,Tuv Taam Salads,Listeria monocytogenes,10/2010
1077,http://www.fda.gov/Safety/Recalls/ArchiveRecalls/2010/ucm231430.htm,Sandoz Inc.,Methotrexate injection,"Sandoz, Parenta",May contain glass flakes,10/2010
1078,http://www.fda.gov/Safety/Recalls/ArchiveRecalls/2010/ucm231324.htm,"bioMérieux, Inc.",VITEK® 2 Gram Negative Susceptibility Cards,VITEK® 2,Incorrect results,10/2010
1079,http://www.fda.gov/Safety/Recalls/ArchiveRecalls/2010/ucm232275.htm,Intelli Health Products,Duro Extend Capsules For Men,Duro Extend,Unapproved drug - contains  Sulfoaidenafil,10/2010
1080,http://www.fda.gov/Safety/Recalls/ArchiveRecalls/2010/ucm231639.htm,B. Braun Medical Inc.,heparin,B. Braun,trace amounts of contaminant,10/2010
1081,http://www.fda.gov/Safety/Recalls/ArchiveRecalls/2010/ucm230769.htm,Standard Homeopathic Company,Teething tablets,Hyland,The product may contain inconsistent amounts of the substance belladonna,10/2010
1082,http://www.fda.gov/Safety/Recalls/ArchiveRecalls/2010/ucm230723.htm,Nestle USA,Raisinets,Nestle,Undeclared peanuts,10/2010
1083,http://www.fda.gov/Safety/Recalls/ArchiveRecalls/2010/ucm230773.htm,Colombina S.A.,Flavored lollipops,Mega Pops,May contain foreign particles,10/2010
1084,http://www.fda.gov/Safety/Recalls/ArchiveRecalls/2010/ucm230558.htm,"Foremost Foods International, Inc.",Dried Seafood Products,Tomi,Clostridium botulinum,10/2010
1085,http://www.fda.gov/Safety/Recalls/ArchiveRecalls/2010/ucm230670.htm,"Western Milling, LLC",Turkey Feed,"Universal, Kruse Perfection",Contaminated with monensin,10/2010
1086,http://www.fda.gov/Safety/Recalls/ArchiveRecalls/2010/ucm230498.htm,Actavis Inc.,Fentanyl patch,Actavis,released its active ingredient faster than the approved specification,10/2010
1087,http://www.fda.gov/Safety/Recalls/ArchiveRecalls/2010/ucm230528.htm,"Del Monte Fresh Produce N.A., Inc.",Cantaloupes,Del Monte Fresh,Salmonella,10/2010
1088,http://www.fda.gov/Safety/Recalls/ArchiveRecalls/2010/ucm230709.htm,Sangar Fresh Cut Produce,fresh cut produce,Sangar,Listeria monocytogenes,10/2010
1089,http://www.fda.gov/Safety/Recalls/ArchiveRecalls/2010/ucm230135.htm,McNeil Consumer Healthcare,"Over the counter (OTC) products, 8 Hour Caplets",Tylenol,"Uncharacteristic smell caused by the presence of trace amounts of a chemical called 2,4,6-tribromoanisole (TBA)",10/2010
1090,http://www.fda.gov/Safety/Recalls/ArchiveRecalls/2010/ucm229941.htm,Pats Exotic Beverages Inc.,Beverages,,Manufactured without the required processes in place to control food borne pathogens,10/2010
1091,http://www.fda.gov/Safety/Recalls/ArchiveRecalls/2010/ucm229838.htm,Pictsweet Company,Frozen Green Peas,Pictsweet,Glass,10/2010
1092,http://www.fda.gov/Safety/Recalls/ArchiveRecalls/2010/ucm232984.htm,CareFusion,PC Units,Alaris,"may experience an intermittent communication error, freezing screen",10/2010
1093,http://www.fda.gov/Safety/Recalls/ArchiveRecalls/2010/ucm229531.htm,Excelsior Medical Corporation,Prefilled Saline Flush Syringe,Excelsior,Potential leak and loss of sterility,10/2010
1094,http://www.fda.gov/Safety/Recalls/ArchiveRecalls/2010/ucm229527.htm,Pictsweet Company,Breaded Okra,Pictsweet,Undeclared milk product,10/2010
1095,http://www.fda.gov/Safety/Recalls/ArchiveRecalls/2010/ucm228998.htm,Pfizer,,Lipitor,off odor,10/2010
1096,http://www.fda.gov/Safety/Recalls/ArchiveRecalls/2010/ucm228986.htm,"Blue Buffalo Company, Ltd.",Dog food,Blue,Excess Vitamin D,10/2010
1097,http://www.fda.gov/Safety/Recalls/ArchiveRecalls/2010/ucm228692.htm,"Living Foods, Inc.",Alfalfa Sprouts,"Living Foods, Inc.",Salmonella,10/2010
1098,http://www.fda.gov/Safety/Recalls/ArchiveRecalls/2010/ucm228749.htm,Gaspari Nutrition,Novedex XT,Novedex XT,may contain an Aromatase Inhibitor,10/2010
1099,http://www.fda.gov/Safety/Recalls/ArchiveRecalls/2010/ucm228817.htm,"D &amp; M Smoked Fish, Inc. (DBA Haifa Smoked Fish)",Smoked Fish,Haifa Smoked Fish,Listeria monocytogenes,10/2010
1100,http://www.fda.gov/Safety/Recalls/ArchiveRecalls/2010/ucm228972.htm,Montalvan&#39;s Sales,Ice Cream,La Nuestra,Salmonella,10/2010
1101,http://www.fda.gov/Safety/Recalls/ArchiveRecalls/2010/ucm228316.htm,Lucerne Foods,Western Hazelnut Bread,Oregon Bread,"Undeclared cashews, almonds and Brazil nuts",10/2010
1102,http://www.fda.gov/Safety/Recalls/ArchiveRecalls/2010/ucm228065.htm,Rising Dough Bakery,Cranberry Muffins,Rising Dough,Undeclared walnuts,09/2010
1103,http://www.fda.gov/Safety/Recalls/ArchiveRecalls/2010/ucm227972.htm,"Hostess Brands, Inc.",,Hostess,Undeclared walnuts,09/2010
1104,http://www.fda.gov/Safety/Recalls/ArchiveRecalls/2010/ucm227202.htm,Amgen,EPOGEN® and PROCRIT® (Epoetin alfa) vials,Epogen,Glass flakes in vials,09/2010
1105,http://www.fda.gov/Safety/Recalls/ArchiveRecalls/2010/ucm227658.htm,"Pfizer, Inc.",ThermaCare HeatWraps Menstrual,ThermaCare,Potential leak of the components contained in the wrap,09/2010
1106,http://www.fda.gov/Safety/Recalls/ArchiveRecalls/2010/ucm227071.htm,Red Lotus Bakery,Butter Cup Cakes,Red Lotus Bakery,Undeclared eggs,09/2010
1107,http://www.fda.gov/Safety/Recalls/ArchiveRecalls/2010/ucm226948.htm,Deluxe Ice Cream,Ice cream,Western Family,Undeclared peanuts,09/2010
1108,http://www.fda.gov/Safety/Recalls/ArchiveRecalls/2010/ucm226918.htm,Suzipoo,Candy,Suzipoo,Undeclared peanuts,09/2010
1109,http://www.fda.gov/Safety/Recalls/ArchiveRecalls/2010/ucm226885.htm,Abbott,Powder Infant Formula,Similac,Insect contamination,09/2010
1110,http://www.fda.gov/Safety/Recalls/ArchiveRecalls/2010/ucm227065.htm,General Mills,Granola Thins,Nature Valley,Undeclared peanut butter,09/2010
1111,http://www.fda.gov/Safety/Recalls/ArchiveRecalls/2010/ucm226879.htm,House of Spices,Star noodles TamTam,Garvi Gujarat,Undeclared peanuts,09/2010
1112,http://www.fda.gov/Safety/Recalls/ArchiveRecalls/2010/ucm226312.htm,Dough Masters Inc.,Cookies,Fresh to Go,Undeclared walnuts,09/2010
1113,http://www.fda.gov/Safety/Recalls/ArchiveRecalls/2010/ucm226145.htm,Advanced Muscle Science,"Arom-X, Arom-X UTT, Arom-XL, 4-AD, and Decavol",Advanced Muscle Science,may contain an Aromatase Inhibitor,09/2010
1114,http://www.fda.gov/Safety/Recalls/ArchiveRecalls/2010/ucm226259.htm,"Tribravus Enterprises, LLC d/b/a/ iForce Nutrition, LLC",Reversitol capsules,IForce,May contain an Aromatase Inhibitor,09/2010
1115,http://www.fda.gov/Safety/Recalls/ArchiveRecalls/2010/ucm226267.htm,Hallmark Fisheries,packaged crab meat products,"Hallmark, Peacock, Quality Ocean International, more",Listeria monocytogenes,09/2010
1116,http://www.fda.gov/Safety/Recalls/ArchiveRecalls/2010/ucm226109.htm,Fizogen Precision Technologies,Off Cycle II Hardcore,Fizogen Precision Technologies,may contain an Aromatase Inhibitor,09/2010
1117,http://www.fda.gov/Safety/Recalls/ArchiveRecalls/2010/ucm225847.htm,KiloSports Inc.,Clomed,Clomed,may contain an Aromatase Inhibitor,09/2010
1118,http://www.fda.gov/Safety/Recalls/ArchiveRecalls/2010/ucm225844.htm,"Westmed, Inc.",Manual Resuscitation Devices,BagEasy,Disconnection at the retention ring of the patient port manifold causes the unit to be inoperable.,09/2010
1119,http://www.fda.gov/Safety/Recalls/ArchiveRecalls/2010/ucm225848.htm,Genetic Edge Technologies,ArimaDex,"G.E.T Genetic Edge Technologies, Inc.",may contain an Aromatase Inhibitor,09/2010
1120,http://www.fda.gov/Safety/Recalls/ArchiveRecalls/2010/ucm225221.htm,Midland Farms,,"Midland Farms, Corrado&#39;s Market, Jersey Dairy Farms, more",Improper Pasteurization,09/2010
1121,http://www.fda.gov/Safety/Recalls/ArchiveRecalls/2010/ucm224977.htm,Real Taste Noodle Manufacture,Egg Noodle,,Salmonella,09/2010
1122,http://www.fda.gov/Safety/Recalls/ArchiveRecalls/2010/ucm224988.htm,Sparboe Farms,Eggs,"Market Pantry, Sparboe Farms",Salmonella,09/2010
1123,http://www.fda.gov/Safety/Recalls/ArchiveRecalls/2010/ucm224987.htm,Hartz Mountain Corporation,Dog treats,Hartz Naturals,Salmonella,09/2010
1124,http://www.fda.gov/Safety/Recalls/ArchiveRecalls/2010/ucm224797.htm,Whole Foods Market,Cheese,"Morningland Dairy, Ozark Hills Farm",Listeria monocytogenes and Staphylococcus aureus,09/2010
1125,http://www.fda.gov/Safety/Recalls/ArchiveRecalls/2010/ucm224712.htm,Torn &amp; Glasser,"Mixed nuts, no peanuts",Torn &amp; Glasser,Undeclared Peanuts,09/2010
1126,http://www.fda.gov/Safety/Recalls/ArchiveRecalls/2010/ucm224929.htm,"Cibo Vita, Inc.",Mediterranean Mix,Woodpecker,Undeclared sulfites,09/2010
1127,http://www.fda.gov/Safety/Recalls/ucm340248.htm,MKG Provisions,Atlantic Smoked Salmon,"UpRiver, Nordic Choice",Potential to be contaminated with Listeria monocytogenes,09/2010
1128,http://www.fda.gov/Safety/Recalls/ArchiveRecalls/2010/ucm224675.htm,The Procter &amp; Gamble Company,,Iams,Salmonella,08/2010
1129,http://www.fda.gov/Safety/Recalls/ArchiveRecalls/2010/ucm224494.htm,"Morningland Dairy of the Ozarks, LLC",Cheese,"Morningland Dairy, Ozark Hills Farm",Listeria monocytogenes and Staphylococcus aureus,08/2010
1130,http://www.fda.gov/Safety/Recalls/ArchiveRecalls/2010/ucm224843.htm,"Good Taste Noodle MFG., Inc.",Egg noodles and wonton skins,Taste Good,Salmonella,08/2010
1131,http://www.fda.gov/Safety/Recalls/ArchiveRecalls/2010/ucm224352.htm,The Procter &amp; Gamble Company,,Iams,Salmonella,08/2010
1132,http://www.fda.gov/Safety/Recalls/ArchiveRecalls/2010/ucm224300.htm,QUESERIA CHIPILO INC.,,"QUESERIA CHIPILO, QUESO CHIPILO,   CHIPILO, more",Listeria monocytogenes,08/2010
1133,http://www.fda.gov/Safety/Recalls/ArchiveRecalls/2010/ucm224301.htm,Sparboe Farms,,,Salmonella,08/2010
1134,http://www.fda.gov/Safety/Recalls/ArchiveRecalls/2010/ucm224510.htm,Paleta California Co.,Frozen Mamey Fruit Bars,Paleta California,Salmonella typhi,08/2010
